{
  "version": 1,
  "flink" : {
    "format" : "avro",
    "bootstrap.servers": "${sys:datasqrl.kafka_servers}",
    "group.id": "datasqrl-orders",
    "connector" : "kafka"
  },
  "table" : {
    "type" : "source",
    "primary-key" : ["id", "time"],
    "timestamp" : "_source_time",
    "watermark-millis" : "0"
  },
  "metadata" : {
    "_source_time" : {
      "attribute" : "timestamp",
      "type": "TIMESTAMP_WITH_LOCAL_TIME_ZONE(3)"
    }
  }

}