{
  "version": 1,
  "flink" : {
    "format" : "json",
    "path" : "file:/mock",
    "source.monitor-interval" : 10000,
    "connector" : "filesystem",
    "source.path.regex-pattern" : ""
  },
  "table" : {
    "type" : "source",
    "primary-key" : ["customerid", "lastUpdated"],
    "partition-key" : ["customerid"],
    "timestamp" : "timestamp",
    "watermark-millis" : "1"
  },
  "metadata" : {
    "timestamp" : {
      "attribute" : "time.epochToTimestamp(lastUpdated)"
    }
  }
}