{
  "version": 1,
  "flink" : {
    "connector" : "datagen",
    "number-of-rows": "10",
    "fields.ID.kind": "sequence",
    "fields.ID.start": "0",
    "fields.ID.end": "9",
    "fields.EPOCH_TIMESTAMP.kind": "sequence",
    "fields.EPOCH_TIMESTAMP.start": "1719318565000",
    "fields.EPOCH_TIMESTAMP.end": "1719319565000",
    "fields.SOME_VALUE.kind": "random",
    "fields._uuid.kind": "random"
  },
  "table" : {
    "type" : "source",
    "primary-key" : ["ID"],
    "timestamp" : "TIMESTAMP",
    "watermark-millis" : "1"
  },
  "metadata" : {
    "TIMESTAMP" : {
      "attribute" : "time.epochMilliToTimestamp(EPOCH_TIMESTAMP)"
    },
    "event_time" : {
      "attribute" : "time.epochMilliToTimestamp(EPOCH_TIMESTAMP)"
    }
  }
}
