{
  "version": 1,
  "flink" : {
    "format" : "flexible-json",
    "path" : "${DATA_PATH}/orders.jsonl",
    "source.monitor-interval" : 10000,
    "connector" : "filesystem"
  },
  "table" : {
    "type" : "source",
    "timestamp" : "_ingest_time",
    "primary-key" : ["id", "customerid", "time"]
  },
  "metadata" : {
    "_ingest_time" : {
      "attribute" : "proctime()"
    }
  }
}